18:30:04.941389 IP 192.168.0.8.60806 > 192.168.0.24.11106: Flags [S], seq 302547943, win 64240, options [mss 1460,sackOK,TS val 1949851273 ecr 0,nop,wscale 7], length 0
18:30:04.941576 IP 192.168.0.8.60806 > 192.168.0.24.11106: Flags [.], ack 1411050975, win 502, options [nop,nop,TS val 1949851273 ecr 2436205], length 0
18:30:04.941867 IP 192.168.0.8.60806 > 192.168.0.24.11106: Flags [.], ack 5, win 502, options [nop,nop,TS val 1949851273 ecr 2436205], length 0
18:30:07.957159 IP 192.168.0.8.46422 > 192.168.0.24.11106: UDP, length 1472
18:30:07.957169 IP 192.168.0.8.46422 > 192.168.0.24.11106: UDP, length 1472
18:30:07.959554 IP 192.168.0.8.46422 > 192.168.0.24.11106: UDP, length 1472
18:30:07.959565 IP 192.168.0.8.46422 > 192.168.0.24.11106: UDP, length 1472
18:30:07.961953 IP 192.168.0.8.46422 > 192.168.0.24.11106: UDP, length 1472
18:30:07.961964 IP 192.168.0.8.46422 > 192.168.0.24.11106: UDP, length 1472
18:30:07.964368 IP 192.168.0.8.46422 > 192.168.0.24.11106: UDP, length 1472
18:30:07.964380 IP 192.168.0.8.46422 > 192.168.0.24.11106: UDP, length 1472
18:30:07.966771 IP 192.168.0.8.46422 > 192.168.0.24.11106: UDP, length 1472
18:30:07.966783 IP 192.168.0.8.46422 > 192.168.0.24.11106: UDP, length 1472
18:30:07.969137 IP 192.168.0.8.46422 > 192.168.0.24.11106: UDP, length 1472
18:30:07.969145 IP 192.168.0.8.46422 > 192.168.0.24.11106: UDP, length 1472
18:30:07.971533 IP 192.168.0.8.46422 > 192.168.0.24.11106: UDP, length 1472
18:30:07.971543 IP 192.168.0.8.46422 > 192.168.0.24.11106: UDP, length 1472
18:30:07.973934 IP 192.168.0.8.46422 > 192.168.0.24.11106: UDP, length 1472
18:30:07.973945 IP 192.168.0.8.46422 > 192.168.0.24.11106: UDP, length 1472
18:30:07.976347 IP 192.168.0.8.46422 > 192.168.0.24.11106: UDP, length 1472
18:30:07.976358 IP 192.168.0.8.46422 > 192.168.0.24.11106: UDP, length 1472
18:30:07.978755 IP 192.168.0.8.46422 > 192.168.0.24.11106: UDP, length 1472
18:30:07.978767 IP 192.168.0.8.46422 > 192.168.0.24.11106: UDP, length 1472
18:30:07.981167 IP 192.168.0.8.46422 > 192.168.0.24.11106: UDP, length 1472
18:30:07.981179 IP 192.168.0.8.46422 > 192.168.0.24.11106: UDP, length 1472
18:30:07.983571 IP 192.168.0.8.46422 > 192.168.0.24.11106: UDP, length 1472
18:30:07.983582 IP 192.168.0.8.46422 > 192.168.0.24.11106: UDP, length 1472
18:30:07.985911 IP 192.168.0.8.46422 > 192.168.0.24.11106: UDP, length 1472
18:30:07.985919 IP 192.168.0.8.46422 > 192.168.0.24.11106: UDP, length 1472
18:30:07.988243 IP 192.168.0.8.46422 > 192.168.0.24.11106: UDP, length 1472
18:30:07.988254 IP 192.168.0.8.46422 > 192.168.0.24.11106: UDP, length 1472
18:30:07.990624 IP 192.168.0.8.46422 > 192.168.0.24.11106: UDP, length 1472
18:30:07.990635 IP 192.168.0.8.46422 > 192.168.0.24.11106: UDP, length 1472
18:30:07.993056 IP 192.168.0.8.46422 > 192.168.0.24.11106: UDP, length 1472
18:30:07.993119 IP 192.168.0.8.46422 > 192.168.0.24.11106: UDP, length 1472
18:30:07.995531 IP 192.168.0.8.46422 > 192.168.0.24.11106: UDP, length 1472
18:30:07.995546 IP 192.168.0.8.46422 > 192.168.0.24.11106: UDP, length 1472
18:30:07.997960 IP 192.168.0.8.46422 > 192.168.0.24.11106: UDP, length 1472
18:30:07.997975 IP 192.168.0.8.46422 > 192.168.0.24.11106: UDP, length 1472
18:30:08.000326 IP 192.168.0.8.46422 > 192.168.0.24.11106: UDP, length 1472
18:30:08.000340 IP 192.168.0.8.46422 > 192.168.0.24.11106: UDP, length 1472
18:30:08.002749 IP 192.168.0.8.46422 > 192.168.0.24.11106: UDP, length 1472
18:30:08.002765 IP 192.168.0.8.46422 > 192.168.0.24.11106: UDP, length 1472
18:30:08.005213 IP 192.168.0.8.46422 > 192.168.0.24.11106: UDP, length 1472
18:30:08.005231 IP 192.168.0.8.46422 > 192.168.0.24.11106: UDP, length 1472
18:30:08.007643 IP 192.168.0.8.46422 > 192.168.0.24.11106: UDP, length 1472
18:30:08.007659 IP 192.168.0.8.46422 > 192.168.0.24.11106: UDP, length 1472
18:30:08.010078 IP 192.168.0.8.46422 > 192.168.0.24.11106: UDP, length 1472
18:30:08.010098 IP 192.168.0.8.46422 > 192.168.0.24.11106: UDP, length 1472
18:30:08.012519 IP 192.168.0.8.46422 > 192.168.0.24.11106: UDP, length 1472
18:30:08.012538 IP 192.168.0.8.46422 > 192.168.0.24.11106: UDP, length 1472
18:30:08.014962 IP 192.168.0.8.46422 > 192.168.0.24.11106: UDP, length 1472
18:30:08.014980 IP 192.168.0.8.46422 > 192.168.0.24.11106: UDP, length 1472
18:30:08.017377 IP 192.168.0.8.46422 > 192.168.0.24.11106: UDP, length 1472
18:30:08.017395 IP 192.168.0.8.46422 > 192.168.0.24.11106: UDP, length 1472
18:30:08.019836 IP 192.168.0.8.46422 > 192.168.0.24.11106: UDP, length 1472
18:30:08.019856 IP 192.168.0.8.46422 > 192.168.0.24.11106: UDP, length 1472
18:30:08.022289 IP 192.168.0.8.46422 > 192.168.0.24.11106: UDP, length 1472
18:30:08.022307 IP 192.168.0.8.46422 > 192.168.0.24.11106: UDP, length 1472
18:30:08.024756 IP 192.168.0.8.46422 > 192.168.0.24.11106: UDP, length 1472
18:30:08.024777 IP 192.168.0.8.46422 > 192.168.0.24.11106: UDP, length 1472
18:30:08.027226 IP 192.168.0.8.46422 > 192.168.0.24.11106: UDP, length 1472
18:30:08.027248 IP 192.168.0.8.46422 > 192.168.0.24.11106: UDP, length 1472
18:30:08.029687 IP 192.168.0.8.46422 > 192.168.0.24.11106: UDP, length 1472
18:30:08.029706 IP 192.168.0.8.46422 > 192.168.0.24.11106: UDP, length 1472
18:30:08.032137 IP 192.168.0.8.46422 > 192.168.0.24.11106: UDP, length 1472
18:30:08.032156 IP 192.168.0.8.46422 > 192.168.0.24.11106: UDP, length 1472
18:30:08.034594 IP 192.168.0.8.46422 > 192.168.0.24.11106: UDP, length 1472
18:30:08.034614 IP 192.168.0.8.46422 > 192.168.0.24.11106: UDP, length 1472
18:30:08.037064 IP 192.168.0.8.46422 > 192.168.0.24.11106: UDP, length 1472
18:30:08.037137 IP 192.168.0.8.46422 > 192.168.0.24.11106: UDP, length 1472
18:30:08.039570 IP 192.168.0.8.46422 > 192.168.0.24.11106: UDP, length 1472
18:30:08.039590 IP 192.168.0.8.46422 > 192.168.0.24.11106: UDP, length 1472
18:30:08.042027 IP 192.168.0.8.46422 > 192.168.0.24.11106: UDP, length 1472
18:30:08.042046 IP 192.168.0.8.46422 > 192.168.0.24.11106: UDP, length 1472
18:30:08.044479 IP 192.168.0.8.46422 > 192.168.0.24.11106: UDP, length 1472
18:30:08.044500 IP 192.168.0.8.46422 > 192.168.0.24.11106: UDP, length 1472
18:30:08.046910 IP 192.168.0.8.46422 > 192.168.0.24.11106: UDP, length 1472
18:30:08.046930 IP 192.168.0.8.46422 > 192.168.0.24.11106: UDP, length 1472
18:30:08.049368 IP 192.168.0.8.46422 > 192.168.0.24.11106: UDP, length 1472
18:30:08.049387 IP 192.168.0.8.46422 > 192.168.0.24.11106: UDP, length 1472
18:30:08.051818 IP 192.168.0.8.46422 > 192.168.0.24.11106: UDP, length 1472
18:30:08.051837 IP 192.168.0.8.46422 > 192.168.0.24.11106: UDP, length 1472
18:30:08.054286 IP 192.168.0.8.46422 > 192.168.0.24.11106: UDP, length 1472
18:30:08.054308 IP 192.168.0.8.46422 > 192.168.0.24.11106: UDP, length 1472
18:30:08.056740 IP 192.168.0.8.46422 > 192.168.0.24.11106: UDP, length 1472
18:30:08.056760 IP 192.168.0.8.46422 > 192.168.0.24.11106: UDP, length 1472
18:30:08.059196 IP 192.168.0.8.46422 > 192.168.0.24.11106: UDP, length 1472
18:30:08.059216 IP 192.168.0.8.46422 > 192.168.0.24.11106: UDP, length 1472
18:30:08.061653 IP 192.168.0.8.46422 > 192.168.0.24.11106: UDP, length 1472
18:30:08.061673 IP 192.168.0.8.46422 > 192.168.0.24.11106: UDP, length 1472
18:30:08.064117 IP 192.168.0.8.46422 > 192.168.0.24.11106: UDP, length 1472
18:30:08.064138 IP 192.168.0.8.46422 > 192.168.0.24.11106: UDP, length 1472
18:30:08.066577 IP 192.168.0.8.46422 > 192.168.0.24.11106: UDP, length 1472
18:30:08.066596 IP 192.168.0.8.46422 > 192.168.0.24.11106: UDP, length 1472
18:30:08.069027 IP 192.168.0.8.46422 > 192.168.0.24.11106: UDP, length 1472
18:30:08.069116 IP 192.168.0.8.46422 > 192.168.0.24.11106: UDP, length 1472
18:30:08.071548 IP 192.168.0.8.46422 > 192.168.0.24.11106: UDP, length 1472
18:30:08.071568 IP 192.168.0.8.46422 > 192.168.0.24.11106: UDP, length 1472
18:30:08.074007 IP 192.168.0.8.46422 > 192.168.0.24.11106: UDP, length 1472
18:30:08.074027 IP 192.168.0.8.46422 > 192.168.0.24.11106: UDP, length 1472
18:30:08.076458 IP 192.168.0.8.46422 > 192.168.0.24.11106: UDP, length 1472
18:30:08.076477 IP 192.168.0.8.46422 > 192.168.0.24.11106: UDP, length 1472
18:30:08.078915 IP 192.168.0.8.46422 > 192.168.0.24.11106: UDP, length 1472
18:30:08.078935 IP 192.168.0.8.46422 > 192.168.0.24.11106: UDP, length 1472
18:30:08.081372 IP 192.168.0.8.46422 > 192.168.0.24.11106: UDP, length 1472
18:30:08.081391 IP 192.168.0.8.46422 > 192.168.0.24.11106: UDP, length 1472
18:30:08.083824 IP 192.168.0.8.46422 > 192.168.0.24.11106: UDP, length 1472
18:30:08.083844 IP 192.168.0.8.46422 > 192.168.0.24.11106: UDP, length 1472
18:30:08.086282 IP 192.168.0.8.46422 > 192.168.0.24.11106: UDP, length 1472
18:30:08.086301 IP 192.168.0.8.46422 > 192.168.0.24.11106: UDP, length 1472
18:30:08.088733 IP 192.168.0.8.46422 > 192.168.0.24.11106: UDP, length 1472
18:30:08.088753 IP 192.168.0.8.46422 > 192.168.0.24.11106: UDP, length 1472
18:30:08.091200 IP 192.168.0.8.46422 > 192.168.0.24.11106: UDP, length 1472
18:30:08.091221 IP 192.168.0.8.46422 > 192.168.0.24.11106: UDP, length 1472
18:30:08.093621 IP 192.168.0.8.46422 > 192.168.0.24.11106: UDP, length 1472
18:30:08.093638 IP 192.168.0.8.46422 > 192.168.0.24.11106: UDP, length 1472
18:30:08.096067 IP 192.168.0.8.46422 > 192.168.0.24.11106: UDP, length 1472
18:30:08.096087 IP 192.168.0.8.46422 > 192.168.0.24.11106: UDP, length 1472
18:30:08.098526 IP 192.168.0.8.46422 > 192.168.0.24.11106: UDP, length 1472
18:30:08.098547 IP 192.168.0.8.46422 > 192.168.0.24.11106: UDP, length 1472
18:30:08.100989 IP 192.168.0.8.46422 > 192.168.0.24.11106: UDP, length 1472
18:30:08.101014 IP 192.168.0.8.46422 > 192.168.0.24.11106: UDP, length 1472
18:30:08.103449 IP 192.168.0.8.46422 > 192.168.0.24.11106: UDP, length 1472
18:30:08.103471 IP 192.168.0.8.46422 > 192.168.0.24.11106: UDP, length 1472
18:30:08.105907 IP 192.168.0.8.46422 > 192.168.0.24.11106: UDP, length 1472
18:30:08.105929 IP 192.168.0.8.46422 > 192.168.0.24.11106: UDP, length 1472
18:30:08.108361 IP 192.168.0.8.46422 > 192.168.0.24.11106: UDP, length 1472
18:30:08.108382 IP 192.168.0.8.46422 > 192.168.0.24.11106: UDP, length 1472
18:30:08.110836 IP 192.168.0.8.46422 > 192.168.0.24.11106: UDP, length 1472
18:30:08.110860 IP 192.168.0.8.46422 > 192.168.0.24.11106: UDP, length 1472
18:30:08.113298 IP 192.168.0.8.46422 > 192.168.0.24.11106: UDP, length 1472
18:30:08.113320 IP 192.168.0.8.46422 > 192.168.0.24.11106: UDP, length 1472
18:30:08.115750 IP 192.168.0.8.46422 > 192.168.0.24.11106: UDP, length 1472
18:30:08.115771 IP 192.168.0.8.46422 > 192.168.0.24.11106: UDP, length 1472
18:30:08.118202 IP 192.168.0.8.46422 > 192.168.0.24.11106: UDP, length 1472
18:30:08.118224 IP 192.168.0.8.46422 > 192.168.0.24.11106: UDP, length 1472
18:30:08.120655 IP 192.168.0.8.46422 > 192.168.0.24.11106: UDP, length 1472
18:30:08.120677 IP 192.168.0.8.46422 > 192.168.0.24.11106: UDP, length 1472
18:30:08.123116 IP 192.168.0.8.46422 > 192.168.0.24.11106: UDP, length 1472
18:30:08.123139 IP 192.168.0.8.46422 > 192.168.0.24.11106: UDP, length 1472
18:30:08.125575 IP 192.168.0.8.46422 > 192.168.0.24.11106: UDP, length 1472
18:30:08.125597 IP 192.168.0.8.46422 > 192.168.0.24.11106: UDP, length 1472
18:30:08.128028 IP 192.168.0.8.46422 > 192.168.0.24.11106: UDP, length 1472
18:30:08.128050 IP 192.168.0.8.46422 > 192.168.0.24.11106: UDP, length 1472
18:30:08.130497 IP 192.168.0.8.46422 > 192.168.0.24.11106: UDP, length 1472
18:30:08.130521 IP 192.168.0.8.46422 > 192.168.0.24.11106: UDP, length 1472
18:30:08.132952 IP 192.168.0.8.46422 > 192.168.0.24.11106: UDP, length 1472
18:30:08.132974 IP 192.168.0.8.46422 > 192.168.0.24.11106: UDP, length 1472
18:30:08.135405 IP 192.168.0.8.46422 > 192.168.0.24.11106: UDP, length 1472
18:30:08.135427 IP 192.168.0.8.46422 > 192.168.0.24.11106: UDP, length 1472
18:30:08.137869 IP 192.168.0.8.46422 > 192.168.0.24.11106: UDP, length 1472
18:30:08.137894 IP 192.168.0.8.46422 > 192.168.0.24.11106: UDP, length 1472
18:30:08.140323 IP 192.168.0.8.46422 > 192.168.0.24.11106: UDP, length 1472
18:30:08.140345 IP 192.168.0.8.46422 > 192.168.0.24.11106: UDP, length 1472
18:30:08.142777 IP 192.168.0.8.46422 > 192.168.0.24.11106: UDP, length 1472
18:30:08.142799 IP 192.168.0.8.46422 > 192.168.0.24.11106: UDP, length 1472
18:30:08.145234 IP 192.168.0.8.46422 > 192.168.0.24.11106: UDP, length 1472
18:30:08.145256 IP 192.168.0.8.46422 > 192.168.0.24.11106: UDP, length 1472
18:30:08.147699 IP 192.168.0.8.46422 > 192.168.0.24.11106: UDP, length 1472
18:30:08.147726 IP 192.168.0.8.46422 > 192.168.0.24.11106: UDP, length 1472
18:30:08.150165 IP 192.168.0.8.46422 > 192.168.0.24.11106: UDP, length 1472
18:30:08.150189 IP 192.168.0.8.46422 > 192.168.0.24.11106: UDP, length 1472
18:30:08.152620 IP 192.168.0.8.46422 > 192.168.0.24.11106: UDP, length 1472
18:30:08.152644 IP 192.168.0.8.46422 > 192.168.0.24.11106: UDP, length 1472
18:30:08.155080 IP 192.168.0.8.46422 > 192.168.0.24.11106: UDP, length 1472
18:30:08.155102 IP 192.168.0.8.46422 > 192.168.0.24.11106: UDP, length 1472
18:30:08.157537 IP 192.168.0.8.46422 > 192.168.0.24.11106: UDP, length 1472
18:30:08.157559 IP 192.168.0.8.46422 > 192.168.0.24.11106: UDP, length 1472
18:30:08.159992 IP 192.168.0.8.46422 > 192.168.0.24.11106: UDP, length 1472
18:30:08.160013 IP 192.168.0.8.46422 > 192.168.0.24.11106: UDP, length 1472
18:30:08.162410 IP 192.168.0.8.46422 > 192.168.0.24.11106: UDP, length 1472
18:30:08.162437 IP 192.168.0.8.46422 > 192.168.0.24.11106: UDP, length 1472
18:30:08.164869 IP 192.168.0.8.46422 > 192.168.0.24.11106: UDP, length 1472
18:30:08.164892 IP 192.168.0.8.46422 > 192.168.0.24.11106: UDP, length 1472
18:30:08.167339 IP 192.168.0.8.46422 > 192.168.0.24.11106: UDP, length 1472
18:30:08.167364 IP 192.168.0.8.46422 > 192.168.0.24.11106: UDP, length 1472
18:30:08.169812 IP 192.168.0.8.46422 > 192.168.0.24.11106: UDP, length 1472
18:30:08.169838 IP 192.168.0.8.46422 > 192.168.0.24.11106: UDP, length 1472
18:30:08.172274 IP 192.168.0.8.46422 > 192.168.0.24.11106: UDP, length 1472
18:30:08.172299 IP 192.168.0.8.46422 > 192.168.0.24.11106: UDP, length 1472
18:30:08.174749 IP 192.168.0.8.46422 > 192.168.0.24.11106: UDP, length 1472
18:30:08.174774 IP 192.168.0.8.46422 > 192.168.0.24.11106: UDP, length 1472
18:30:08.177228 IP 192.168.0.8.46422 > 192.168.0.24.11106: UDP, length 1472
18:30:08.177255 IP 192.168.0.8.46422 > 192.168.0.24.11106: UDP, length 1472
18:30:08.179688 IP 192.168.0.8.46422 > 192.168.0.24.11106: UDP, length 1472
18:30:08.179712 IP 192.168.0.8.46422 > 192.168.0.24.11106: UDP, length 1472
18:30:08.182149 IP 192.168.0.8.46422 > 192.168.0.24.11106: UDP, length 1472
18:30:08.182173 IP 192.168.0.8.46422 > 192.168.0.24.11106: UDP, length 1472
18:30:08.184604 IP 192.168.0.8.46422 > 192.168.0.24.11106: UDP, length 1472
18:30:08.184626 IP 192.168.0.8.46422 > 192.168.0.24.11106: UDP, length 1472
18:30:08.187063 IP 192.168.0.8.46422 > 192.168.0.24.11106: UDP, length 1472
18:30:08.187087 IP 192.168.0.8.46422 > 192.168.0.24.11106: UDP, length 1472
18:30:08.189526 IP 192.168.0.8.46422 > 192.168.0.24.11106: UDP, length 1472
18:30:08.189548 IP 192.168.0.8.46422 > 192.168.0.24.11106: UDP, length 1472
18:30:08.191981 IP 192.168.0.8.46422 > 192.168.0.24.11106: UDP, length 1472
18:30:08.192004 IP 192.168.0.8.46422 > 192.168.0.24.11106: UDP, length 1472
18:30:08.194459 IP 192.168.0.8.46422 > 192.168.0.24.11106: UDP, length 1472
18:30:08.194486 IP 192.168.0.8.46422 > 192.168.0.24.11106: UDP, length 1472
18:30:08.196844 IP 192.168.0.8.46422 > 192.168.0.24.11106: UDP, length 1472
18:30:08.196865 IP 192.168.0.8.46422 > 192.168.0.24.11106: UDP, length 1472
18:30:08.199208 IP 192.168.0.8.46422 > 192.168.0.24.11106: UDP, length 1472
18:30:08.199229 IP 192.168.0.8.46422 > 192.168.0.24.11106: UDP, length 1472
18:30:08.201556 IP 192.168.0.8.46422 > 192.168.0.24.11106: UDP, length 1472
18:30:08.201569 IP 192.168.0.8.46422 > 192.168.0.24.11106: UDP, length 1472
18:30:08.203995 IP 192.168.0.8.46422 > 192.168.0.24.11106: UDP, length 1472
18:30:08.204019 IP 192.168.0.8.46422 > 192.168.0.24.11106: UDP, length 1472
18:30:08.206452 IP 192.168.0.8.46422 > 192.168.0.24.11106: UDP, length 1472
18:30:08.206476 IP 192.168.0.8.46422 > 192.168.0.24.11106: UDP, length 1472
18:30:08.208904 IP 192.168.0.8.46422 > 192.168.0.24.11106: UDP, length 1472
18:30:08.208926 IP 192.168.0.8.46422 > 192.168.0.24.11106: UDP, length 1472
18:30:08.211358 IP 192.168.0.8.46422 > 192.168.0.24.11106: UDP, length 1472
18:30:08.211382 IP 192.168.0.8.46422 > 192.168.0.24.11106: UDP, length 1472
18:30:08.213754 IP 192.168.0.8.46422 > 192.168.0.24.11106: UDP, length 1472
18:30:08.213779 IP 192.168.0.8.46422 > 192.168.0.24.11106: UDP, length 1472
18:30:08.216207 IP 192.168.0.8.46422 > 192.168.0.24.11106: UDP, length 1472
18:30:08.216231 IP 192.168.0.8.46422 > 192.168.0.24.11106: UDP, length 1472
18:30:08.218659 IP 192.168.0.8.46422 > 192.168.0.24.11106: UDP, length 1472
18:30:08.218683 IP 192.168.0.8.46422 > 192.168.0.24.11106: UDP, length 1472
18:30:08.221203 IP 192.168.0.8.46422 > 192.168.0.24.11106: UDP, length 1472
18:30:08.221229 IP 192.168.0.8.46422 > 192.168.0.24.11106: UDP, length 1472
18:30:08.223662 IP 192.168.0.8.46422 > 192.168.0.24.11106: UDP, length 1472
18:30:08.223684 IP 192.168.0.8.46422 > 192.168.0.24.11106: UDP, length 1472
18:30:08.226121 IP 192.168.0.8.46422 > 192.168.0.24.11106: UDP, length 1472
18:30:08.226145 IP 192.168.0.8.46422 > 192.168.0.24.11106: UDP, length 1472
18:30:08.228576 IP 192.168.0.8.46422 > 192.168.0.24.11106: UDP, length 1472
18:30:08.228598 IP 192.168.0.8.46422 > 192.168.0.24.11106: UDP, length 1472
18:30:08.231046 IP 192.168.0.8.46422 > 192.168.0.24.11106: UDP, length 1472
18:30:08.231072 IP 192.168.0.8.46422 > 192.168.0.24.11106: UDP, length 1472
18:30:08.233510 IP 192.168.0.8.46422 > 192.168.0.24.11106: UDP, length 1472
18:30:08.233532 IP 192.168.0.8.46422 > 192.168.0.24.11106: UDP, length 1472
18:30:08.235963 IP 192.168.0.8.46422 > 192.168.0.24.11106: UDP, length 1472
18:30:08.235987 IP 192.168.0.8.46422 > 192.168.0.24.11106: UDP, length 1472
18:30:08.238425 IP 192.168.0.8.46422 > 192.168.0.24.11106: UDP, length 1472
18:30:08.238449 IP 192.168.0.8.46422 > 192.168.0.24.11106: UDP, length 1472
18:30:08.240879 IP 192.168.0.8.46422 > 192.168.0.24.11106: UDP, length 1472
18:30:08.240903 IP 192.168.0.8.46422 > 192.168.0.24.11106: UDP, length 1472
18:30:08.243335 IP 192.168.0.8.46422 > 192.168.0.24.11106: UDP, length 1472
18:30:08.243358 IP 192.168.0.8.46422 > 192.168.0.24.11106: UDP, length 1472
18:30:08.245746 IP 192.168.0.8.46422 > 192.168.0.24.11106: UDP, length 1472
18:30:08.245773 IP 192.168.0.8.46422 > 192.168.0.24.11106: UDP, length 1472
18:30:08.248157 IP 192.168.0.8.46422 > 192.168.0.24.11106: UDP, length 1472
18:30:08.248172 IP 192.168.0.8.46422 > 192.168.0.24.11106: UDP, length 1472
18:30:08.250608 IP 192.168.0.8.46422 > 192.168.0.24.11106: UDP, length 1472
18:30:08.250632 IP 192.168.0.8.46422 > 192.168.0.24.11106: UDP, length 1472
18:30:08.253148 IP 192.168.0.8.46422 > 192.168.0.24.11106: UDP, length 1472
18:30:08.253176 IP 192.168.0.8.46422 > 192.168.0.24.11106: UDP, length 1472
18:30:08.255606 IP 192.168.0.8.46422 > 192.168.0.24.11106: UDP, length 1472
18:30:08.255627 IP 192.168.0.8.46422 > 192.168.0.24.11106: UDP, length 1472
18:30:08.258075 IP 192.168.0.8.46422 > 192.168.0.24.11106: UDP, length 1472
18:30:08.258099 IP 192.168.0.8.46422 > 192.168.0.24.11106: UDP, length 1472
18:30:08.260550 IP 192.168.0.8.46422 > 192.168.0.24.11106: UDP, length 1472
18:30:08.260573 IP 192.168.0.8.46422 > 192.168.0.24.11106: UDP, length 1472
18:30:08.263008 IP 192.168.0.8.46422 > 192.168.0.24.11106: UDP, length 1472
18:30:08.263030 IP 192.168.0.8.46422 > 192.168.0.24.11106: UDP, length 1472
18:30:08.265465 IP 192.168.0.8.46422 > 192.168.0.24.11106: UDP, length 1472
18:30:08.265487 IP 192.168.0.8.46422 > 192.168.0.24.11106: UDP, length 1472
18:30:08.267916 IP 192.168.0.8.46422 > 192.168.0.24.11106: UDP, length 1472
18:30:08.267939 IP 192.168.0.8.46422 > 192.168.0.24.11106: UDP, length 1472
18:30:08.270373 IP 192.168.0.8.46422 > 192.168.0.24.11106: UDP, length 1472
18:30:08.270395 IP 192.168.0.8.46422 > 192.168.0.24.11106: UDP, length 1472
18:30:08.272825 IP 192.168.0.8.46422 > 192.168.0.24.11106: UDP, length 1472
18:30:08.272848 IP 192.168.0.8.46422 > 192.168.0.24.11106: UDP, length 1472
18:30:08.275279 IP 192.168.0.8.46422 > 192.168.0.24.11106: UDP, length 1472
18:30:08.275301 IP 192.168.0.8.46422 > 192.168.0.24.11106: UDP, length 1472
18:30:08.277747 IP 192.168.0.8.46422 > 192.168.0.24.11106: UDP, length 1472
18:30:08.277768 IP 192.168.0.8.46422 > 192.168.0.24.11106: UDP, length 1472
18:30:08.280198 IP 192.168.0.8.46422 > 192.168.0.24.11106: UDP, length 1472
18:30:08.280219 IP 192.168.0.8.46422 > 192.168.0.24.11106: UDP, length 1472
18:30:08.282654 IP 192.168.0.8.46422 > 192.168.0.24.11106: UDP, length 1472
18:30:08.282676 IP 192.168.0.8.46422 > 192.168.0.24.11106: UDP, length 1472
18:30:08.285116 IP 192.168.0.8.46422 > 192.168.0.24.11106: UDP, length 1472
18:30:08.285138 IP 192.168.0.8.46422 > 192.168.0.24.11106: UDP, length 1472
18:30:08.287579 IP 192.168.0.8.46422 > 192.168.0.24.11106: UDP, length 1472
18:30:08.287603 IP 192.168.0.8.46422 > 192.168.0.24.11106: UDP, length 1472
18:30:08.290039 IP 192.168.0.8.46422 > 192.168.0.24.11106: UDP, length 1472
18:30:08.290060 IP 192.168.0.8.46422 > 192.168.0.24.11106: UDP, length 1472
18:30:08.292491 IP 192.168.0.8.46422 > 192.168.0.24.11106: UDP, length 1472
18:30:08.292514 IP 192.168.0.8.46422 > 192.168.0.24.11106: UDP, length 1472
18:30:08.294949 IP 192.168.0.8.46422 > 192.168.0.24.11106: UDP, length 1472
18:30:08.294971 IP 192.168.0.8.46422 > 192.168.0.24.11106: UDP, length 1472
18:30:08.297418 IP 192.168.0.8.46422 > 192.168.0.24.11106: UDP, length 1472
18:30:08.297443 IP 192.168.0.8.46422 > 192.168.0.24.11106: UDP, length 1472
18:30:08.299872 IP 192.168.0.8.46422 > 192.168.0.24.11106: UDP, length 1472
18:30:08.299894 IP 192.168.0.8.46422 > 192.168.0.24.11106: UDP, length 1472
18:30:08.302329 IP 192.168.0.8.46422 > 192.168.0.24.11106: UDP, length 1472
18:30:08.302352 IP 192.168.0.8.46422 > 192.168.0.24.11106: UDP, length 1472
18:30:08.304783 IP 192.168.0.8.46422 > 192.168.0.24.11106: UDP, length 1472
18:30:08.304805 IP 192.168.0.8.46422 > 192.168.0.24.11106: UDP, length 1472
18:30:08.307178 IP 192.168.0.8.46422 > 192.168.0.24.11106: UDP, length 1472
18:30:08.307200 IP 192.168.0.8.46422 > 192.168.0.24.11106: UDP, length 1472
18:30:08.309635 IP 192.168.0.8.46422 > 192.168.0.24.11106: UDP, length 1472
18:30:08.309656 IP 192.168.0.8.46422 > 192.168.0.24.11106: UDP, length 1472
18:30:08.312086 IP 192.168.0.8.46422 > 192.168.0.24.11106: UDP, length 1472
18:30:08.312108 IP 192.168.0.8.46422 > 192.168.0.24.11106: UDP, length 1472
18:30:08.314545 IP 192.168.0.8.46422 > 192.168.0.24.11106: UDP, length 1472
18:30:08.314566 IP 192.168.0.8.46422 > 192.168.0.24.11106: UDP, length 1472
18:30:08.316995 IP 192.168.0.8.46422 > 192.168.0.24.11106: UDP, length 1472
18:30:08.317017 IP 192.168.0.8.46422 > 192.168.0.24.11106: UDP, length 1472
18:30:08.319448 IP 192.168.0.8.46422 > 192.168.0.24.11106: UDP, length 1472
18:30:08.319470 IP 192.168.0.8.46422 > 192.168.0.24.11106: UDP, length 1472
18:30:08.321901 IP 192.168.0.8.46422 > 192.168.0.24.11106: UDP, length 1472
18:30:08.321924 IP 192.168.0.8.46422 > 192.168.0.24.11106: UDP, length 1472
18:30:08.324354 IP 192.168.0.8.46422 > 192.168.0.24.11106: UDP, length 1472
18:30:08.324375 IP 192.168.0.8.46422 > 192.168.0.24.11106: UDP, length 1472
18:30:08.326805 IP 192.168.0.8.46422 > 192.168.0.24.11106: UDP, length 1472
18:30:08.326827 IP 192.168.0.8.46422 > 192.168.0.24.11106: UDP, length 1472
18:30:08.329232 IP 192.168.0.8.46422 > 192.168.0.24.11106: UDP, length 1472
18:30:08.329254 IP 192.168.0.8.46422 > 192.168.0.24.11106: UDP, length 1472
18:30:08.331683 IP 192.168.0.8.46422 > 192.168.0.24.11106: UDP, length 1472
18:30:08.331706 IP 192.168.0.8.46422 > 192.168.0.24.11106: UDP, length 1472
18:30:08.334151 IP 192.168.0.8.46422 > 192.168.0.24.11106: UDP, length 1472
18:30:08.334175 IP 192.168.0.8.46422 > 192.168.0.24.11106: UDP, length 1472
18:30:08.336607 IP 192.168.0.8.46422 > 192.168.0.24.11106: UDP, length 1472
18:30:08.336629 IP 192.168.0.8.46422 > 192.168.0.24.11106: UDP, length 1472
18:30:08.339064 IP 192.168.0.8.46422 > 192.168.0.24.11106: UDP, length 1472
18:30:08.339085 IP 192.168.0.8.46422 > 192.168.0.24.11106: UDP, length 1472
18:30:08.341534 IP 192.168.0.8.46422 > 192.168.0.24.11106: UDP, length 1472
18:30:08.341559 IP 192.168.0.8.46422 > 192.168.0.24.11106: UDP, length 1472
18:30:08.344004 IP 192.168.0.8.46422 > 192.168.0.24.11106: UDP, length 1472
18:30:08.344027 IP 192.168.0.8.46422 > 192.168.0.24.11106: UDP, length 1472
18:30:08.346465 IP 192.168.0.8.46422 > 192.168.0.24.11106: UDP, length 1472
18:30:08.346487 IP 192.168.0.8.46422 > 192.168.0.24.11106: UDP, length 1472
18:30:08.348917 IP 192.168.0.8.46422 > 192.168.0.24.11106: UDP, length 1472
18:30:08.348938 IP 192.168.0.8.46422 > 192.168.0.24.11106: UDP, length 1472
18:30:08.351373 IP 192.168.0.8.46422 > 192.168.0.24.11106: UDP, length 1472
18:30:08.351410 IP 192.168.0.8.46422 > 192.168.0.24.11106: UDP, length 1472
18:30:08.353850 IP 192.168.0.8.46422 > 192.168.0.24.11106: UDP, length 1472
18:30:08.353871 IP 192.168.0.8.46422 > 192.168.0.24.11106: UDP, length 1472
18:30:08.356235 IP 192.168.0.8.46422 > 192.168.0.24.11106: UDP, length 1472
18:30:08.356258 IP 192.168.0.8.46422 > 192.168.0.24.11106: UDP, length 1472
18:30:08.358693 IP 192.168.0.8.46422 > 192.168.0.24.11106: UDP, length 1472
18:30:08.358715 IP 192.168.0.8.46422 > 192.168.0.24.11106: UDP, length 1472
18:30:08.361153 IP 192.168.0.8.46422 > 192.168.0.24.11106: UDP, length 1472
18:30:08.361182 IP 192.168.0.8.46422 > 192.168.0.24.11106: UDP, length 1472
18:30:08.363617 IP 192.168.0.8.46422 > 192.168.0.24.11106: UDP, length 1472
18:30:08.363638 IP 192.168.0.8.46422 > 192.168.0.24.11106: UDP, length 1472
18:30:08.366068 IP 192.168.0.8.46422 > 192.168.0.24.11106: UDP, length 1472
18:30:08.366091 IP 192.168.0.8.46422 > 192.168.0.24.11106: UDP, length 1472
18:30:08.368521 IP 192.168.0.8.46422 > 192.168.0.24.11106: UDP, length 1472
18:30:08.368542 IP 192.168.0.8.46422 > 192.168.0.24.11106: UDP, length 1472
18:30:08.370979 IP 192.168.0.8.46422 > 192.168.0.24.11106: UDP, length 1472
18:30:08.371008 IP 192.168.0.8.46422 > 192.168.0.24.11106: UDP, length 1472
18:30:08.373440 IP 192.168.0.8.46422 > 192.168.0.24.11106: UDP, length 1472
18:30:08.373461 IP 192.168.0.8.46422 > 192.168.0.24.11106: UDP, length 1472
18:30:08.375863 IP 192.168.0.8.46422 > 192.168.0.24.11106: UDP, length 1472
18:30:08.375886 IP 192.168.0.8.46422 > 192.168.0.24.11106: UDP, length 1472
18:30:08.378316 IP 192.168.0.8.46422 > 192.168.0.24.11106: UDP, length 1472
18:30:08.378338 IP 192.168.0.8.46422 > 192.168.0.24.11106: UDP, length 1472
18:30:08.380783 IP 192.168.0.8.46422 > 192.168.0.24.11106: UDP, length 1472
18:30:08.380806 IP 192.168.0.8.46422 > 192.168.0.24.11106: UDP, length 1472
18:30:08.383243 IP 192.168.0.8.46422 > 192.168.0.24.11106: UDP, length 1472
18:30:08.383266 IP 192.168.0.8.46422 > 192.168.0.24.11106: UDP, length 1472
18:30:08.385702 IP 192.168.0.8.46422 > 192.168.0.24.11106: UDP, length 1472
18:30:08.385724 IP 192.168.0.8.46422 > 192.168.0.24.11106: UDP, length 1472
18:30:08.388154 IP 192.168.0.8.46422 > 192.168.0.24.11106: UDP, length 1472
18:30:08.388176 IP 192.168.0.8.46422 > 192.168.0.24.11106: UDP, length 1472
18:30:08.390611 IP 192.168.0.8.46422 > 192.168.0.24.11106: UDP, length 1472
18:30:08.390633 IP 192.168.0.8.46422 > 192.168.0.24.11106: UDP, length 1472
18:30:08.393136 IP 192.168.0.8.46422 > 192.168.0.24.11106: UDP, length 1472
18:30:08.393174 IP 192.168.0.8.46422 > 192.168.0.24.11106: UDP, length 1472
18:30:08.395557 IP 192.168.0.8.46422 > 192.168.0.24.11106: UDP, length 1472
18:30:08.395573 IP 192.168.0.8.46422 > 192.168.0.24.11106: UDP, length 1472
18:30:08.397927 IP 192.168.0.8.46422 > 192.168.0.24.11106: UDP, length 1472
18:30:08.397938 IP 192.168.0.8.46422 > 192.168.0.24.11106: UDP, length 1472
18:30:08.400291 IP 192.168.0.8.46422 > 192.168.0.24.11106: UDP, length 1472
18:30:08.400301 IP 192.168.0.8.46422 > 192.168.0.24.11106: UDP, length 1472
18:30:08.402718 IP 192.168.0.8.46422 > 192.168.0.24.11106: UDP, length 1472
18:30:08.402736 IP 192.168.0.8.46422 > 192.168.0.24.11106: UDP, length 1472
18:30:08.405207 IP 192.168.0.8.46422 > 192.168.0.24.11106: UDP, length 1472
18:30:08.405221 IP 192.168.0.8.46422 > 192.168.0.24.11106: UDP, length 1472
18:30:08.407640 IP 192.168.0.8.46422 > 192.168.0.24.11106: UDP, length 1472
18:30:08.407657 IP 192.168.0.8.46422 > 192.168.0.24.11106: UDP, length 1472
18:30:08.410075 IP 192.168.0.8.46422 > 192.168.0.24.11106: UDP, length 1472
18:30:08.410093 IP 192.168.0.8.46422 > 192.168.0.24.11106: UDP, length 1472
18:30:08.412511 IP 192.168.0.8.46422 > 192.168.0.24.11106: UDP, length 1472
18:30:08.412527 IP 192.168.0.8.46422 > 192.168.0.24.11106: UDP, length 1472
18:30:08.414961 IP 192.168.0.8.46422 > 192.168.0.24.11106: UDP, length 1472
18:30:08.414982 IP 192.168.0.8.46422 > 192.168.0.24.11106: UDP, length 1472
18:30:08.417404 IP 192.168.0.8.46422 > 192.168.0.24.11106: UDP, length 1472
18:30:08.417428 IP 192.168.0.8.46422 > 192.168.0.24.11106: UDP, length 1472
18:30:08.419868 IP 192.168.0.8.46422 > 192.168.0.24.11106: UDP, length 1472
18:30:08.419888 IP 192.168.0.8.46422 > 192.168.0.24.11106: UDP, length 1472
18:30:08.422320 IP 192.168.0.8.46422 > 192.168.0.24.11106: UDP, length 1472
18:30:08.422339 IP 192.168.0.8.46422 > 192.168.0.24.11106: UDP, length 1472
18:30:08.424784 IP 192.168.0.8.46422 > 192.168.0.24.11106: UDP, length 1472
18:30:08.424807 IP 192.168.0.8.46422 > 192.168.0.24.11106: UDP, length 1472
18:30:08.427258 IP 192.168.0.8.46422 > 192.168.0.24.11106: UDP, length 1472
18:30:08.427280 IP 192.168.0.8.46422 > 192.168.0.24.11106: UDP, length 1472
18:30:08.429720 IP 192.168.0.8.46422 > 192.168.0.24.11106: UDP, length 1472
18:30:08.429739 IP 192.168.0.8.46422 > 192.168.0.24.11106: UDP, length 1472
18:30:08.432172 IP 192.168.0.8.46422 > 192.168.0.24.11106: UDP, length 1472
18:30:08.432192 IP 192.168.0.8.46422 > 192.168.0.24.11106: UDP, length 1472
18:30:08.434631 IP 192.168.0.8.46422 > 192.168.0.24.11106: UDP, length 1472
18:30:08.434651 IP 192.168.0.8.46422 > 192.168.0.24.11106: UDP, length 1472
18:30:08.437148 IP 192.168.0.8.46422 > 192.168.0.24.11106: UDP, length 1472
18:30:08.437168 IP 192.168.0.8.46422 > 192.168.0.24.11106: UDP, length 1472
18:30:08.439575 IP 192.168.0.8.46422 > 192.168.0.24.11106: UDP, length 1472
18:30:08.439590 IP 192.168.0.8.46422 > 192.168.0.24.11106: UDP, length 1472
18:30:08.442027 IP 192.168.0.8.46422 > 192.168.0.24.11106: UDP, length 1472
18:30:08.442047 IP 192.168.0.8.46422 > 192.168.0.24.11106: UDP, length 1472
18:30:08.444480 IP 192.168.0.8.46422 > 192.168.0.24.11106: UDP, length 1472
18:30:08.444504 IP 192.168.0.8.46422 > 192.168.0.24.11106: UDP, length 1472
18:30:08.446865 IP 192.168.0.8.46422 > 192.168.0.24.11106: UDP, length 1472
18:30:08.446886 IP 192.168.0.8.46422 > 192.168.0.24.11106: UDP, length 1472
18:30:08.449321 IP 192.168.0.8.46422 > 192.168.0.24.11106: UDP, length 1472
18:30:08.449343 IP 192.168.0.8.46422 > 192.168.0.24.11106: UDP, length 1472
18:30:08.451773 IP 192.168.0.8.46422 > 192.168.0.24.11106: UDP, length 1472
18:30:08.451796 IP 192.168.0.8.46422 > 192.168.0.24.11106: UDP, length 1472
18:30:08.454249 IP 192.168.0.8.46422 > 192.168.0.24.11106: UDP, length 1472
18:30:08.454273 IP 192.168.0.8.46422 > 192.168.0.24.11106: UDP, length 1472
18:30:08.456705 IP 192.168.0.8.46422 > 192.168.0.24.11106: UDP, length 1472
18:30:08.456727 IP 192.168.0.8.46422 > 192.168.0.24.11106: UDP, length 1472
18:30:08.459171 IP 192.168.0.8.46422 > 192.168.0.24.11106: UDP, length 1472
18:30:08.459199 IP 192.168.0.8.46422 > 192.168.0.24.11106: UDP, length 1472
18:30:08.461631 IP 192.168.0.8.46422 > 192.168.0.24.11106: UDP, length 1472
18:30:08.461653 IP 192.168.0.8.46422 > 192.168.0.24.11106: UDP, length 1472
18:30:08.464099 IP 192.168.0.8.46422 > 192.168.0.24.11106: UDP, length 1472
18:30:08.464123 IP 192.168.0.8.46422 > 192.168.0.24.11106: UDP, length 1472
18:30:08.466557 IP 192.168.0.8.46422 > 192.168.0.24.11106: UDP, length 1472
18:30:08.466578 IP 192.168.0.8.46422 > 192.168.0.24.11106: UDP, length 1472
18:30:08.469008 IP 192.168.0.8.46422 > 192.168.0.24.11106: UDP, length 1472
18:30:08.469029 IP 192.168.0.8.46422 > 192.168.0.24.11106: UDP, length 1472
18:30:08.471460 IP 192.168.0.8.46422 > 192.168.0.24.11106: UDP, length 1472
18:30:08.471483 IP 192.168.0.8.46422 > 192.168.0.24.11106: UDP, length 1472
18:30:08.473859 IP 192.168.0.8.46422 > 192.168.0.24.11106: UDP, length 1472
18:30:08.473881 IP 192.168.0.8.46422 > 192.168.0.24.11106: UDP, length 1472
18:30:08.476312 IP 192.168.0.8.46422 > 192.168.0.24.11106: UDP, length 1472
18:30:08.476335 IP 192.168.0.8.46422 > 192.168.0.24.11106: UDP, length 1472
18:30:08.478781 IP 192.168.0.8.46422 > 192.168.0.24.11106: UDP, length 1472
18:30:08.478803 IP 192.168.0.8.46422 > 192.168.0.24.11106: UDP, length 1472
18:30:08.481240 IP 192.168.0.8.46422 > 192.168.0.24.11106: UDP, length 1472
18:30:08.481262 IP 192.168.0.8.46422 > 192.168.0.24.11106: UDP, length 1472
18:30:08.483695 IP 192.168.0.8.46422 > 192.168.0.24.11106: UDP, length 1472
18:30:08.483717 IP 192.168.0.8.46422 > 192.168.0.24.11106: UDP, length 1472
18:30:08.486153 IP 192.168.0.8.46422 > 192.168.0.24.11106: UDP, length 1472
18:30:08.486175 IP 192.168.0.8.46422 > 192.168.0.24.11106: UDP, length 1472
18:30:08.488605 IP 192.168.0.8.46422 > 192.168.0.24.11106: UDP, length 1472
18:30:08.488627 IP 192.168.0.8.46422 > 192.168.0.24.11106: UDP, length 1472
18:30:08.491065 IP 192.168.0.8.46422 > 192.168.0.24.11106: UDP, length 1472
18:30:08.491086 IP 192.168.0.8.46422 > 192.168.0.24.11106: UDP, length 1472
18:30:08.493524 IP 192.168.0.8.46422 > 192.168.0.24.11106: UDP, length 1472
18:30:08.493547 IP 192.168.0.8.46422 > 192.168.0.24.11106: UDP, length 1472
18:30:08.495979 IP 192.168.0.8.46422 > 192.168.0.24.11106: UDP, length 1472
18:30:08.496002 IP 192.168.0.8.46422 > 192.168.0.24.11106: UDP, length 1472
18:30:08.498438 IP 192.168.0.8.46422 > 192.168.0.24.11106: UDP, length 1472
18:30:08.498459 IP 192.168.0.8.46422 > 192.168.0.24.11106: UDP, length 1472
18:30:08.500904 IP 192.168.0.8.46422 > 192.168.0.24.11106: UDP, length 1472
18:30:08.500928 IP 192.168.0.8.46422 > 192.168.0.24.11106: UDP, length 1472
18:30:08.503367 IP 192.168.0.8.46422 > 192.168.0.24.11106: UDP, length 1472
18:30:08.503389 IP 192.168.0.8.46422 > 192.168.0.24.11106: UDP, length 1472
18:30:08.505771 IP 192.168.0.8.46422 > 192.168.0.24.11106: UDP, length 1472
18:30:08.505793 IP 192.168.0.8.46422 > 192.168.0.24.11106: UDP, length 1472
18:30:08.508238 IP 192.168.0.8.46422 > 192.168.0.24.11106: UDP, length 1472
18:30:08.508261 IP 192.168.0.8.46422 > 192.168.0.24.11106: UDP, length 1472
18:30:08.510715 IP 192.168.0.8.46422 > 192.168.0.24.11106: UDP, length 1472
18:30:08.510741 IP 192.168.0.8.46422 > 192.168.0.24.11106: UDP, length 1472
18:30:08.513179 IP 192.168.0.8.46422 > 192.168.0.24.11106: UDP, length 1472
18:30:08.513202 IP 192.168.0.8.46422 > 192.168.0.24.11106: UDP, length 1472
18:30:08.515634 IP 192.168.0.8.46422 > 192.168.0.24.11106: UDP, length 1472
18:30:08.515656 IP 192.168.0.8.46422 > 192.168.0.24.11106: UDP, length 1472
18:30:08.518092 IP 192.168.0.8.46422 > 192.168.0.24.11106: UDP, length 1472
18:30:08.518114 IP 192.168.0.8.46422 > 192.168.0.24.11106: UDP, length 1472
18:30:08.520544 IP 192.168.0.8.46422 > 192.168.0.24.11106: UDP, length 1472
18:30:08.520566 IP 192.168.0.8.46422 > 192.168.0.24.11106: UDP, length 1472
18:30:08.523003 IP 192.168.0.8.46422 > 192.168.0.24.11106: UDP, length 1472
18:30:08.523025 IP 192.168.0.8.46422 > 192.168.0.24.11106: UDP, length 1472
18:30:08.525457 IP 192.168.0.8.46422 > 192.168.0.24.11106: UDP, length 1472
18:30:08.525479 IP 192.168.0.8.46422 > 192.168.0.24.11106: UDP, length 1472
18:30:08.527910 IP 192.168.0.8.46422 > 192.168.0.24.11106: UDP, length 1472
18:30:08.527932 IP 192.168.0.8.46422 > 192.168.0.24.11106: UDP, length 1472
18:30:08.530368 IP 192.168.0.8.46422 > 192.168.0.24.11106: UDP, length 1472
18:30:08.530390 IP 192.168.0.8.46422 > 192.168.0.24.11106: UDP, length 1472
18:30:08.532822 IP 192.168.0.8.46422 > 192.168.0.24.11106: UDP, length 1472
18:30:08.532859 IP 192.168.0.8.46422 > 192.168.0.24.11106: UDP, length 1472
18:30:08.535293 IP 192.168.0.8.46422 > 192.168.0.24.11106: UDP, length 1472
18:30:08.535315 IP 192.168.0.8.46422 > 192.168.0.24.11106: UDP, length 1472
18:30:08.537763 IP 192.168.0.8.46422 > 192.168.0.24.11106: UDP, length 1472
18:30:08.537787 IP 192.168.0.8.46422 > 192.168.0.24.11106: UDP, length 1472
18:30:08.540219 IP 192.168.0.8.46422 > 192.168.0.24.11106: UDP, length 1472
18:30:08.540241 IP 192.168.0.8.46422 > 192.168.0.24.11106: UDP, length 1472
18:30:08.542678 IP 192.168.0.8.46422 > 192.168.0.24.11106: UDP, length 1472
18:30:08.542700 IP 192.168.0.8.46422 > 192.168.0.24.11106: UDP, length 1472
18:30:08.545136 IP 192.168.0.8.46422 > 192.168.0.24.11106: UDP, length 1472
18:30:08.545158 IP 192.168.0.8.46422 > 192.168.0.24.11106: UDP, length 1472
18:30:08.547599 IP 192.168.0.8.46422 > 192.168.0.24.11106: UDP, length 1472
18:30:08.547624 IP 192.168.0.8.46422 > 192.168.0.24.11106: UDP, length 1472
18:30:08.550063 IP 192.168.0.8.46422 > 192.168.0.24.11106: UDP, length 1472
18:30:08.550085 IP 192.168.0.8.46422 > 192.168.0.24.11106: UDP, length 1472
18:30:08.552519 IP 192.168.0.8.46422 > 192.168.0.24.11106: UDP, length 1472
18:30:08.552543 IP 192.168.0.8.46422 > 192.168.0.24.11106: UDP, length 1472
18:30:08.554979 IP 192.168.0.8.46422 > 192.168.0.24.11106: UDP, length 1472
18:30:08.555001 IP 192.168.0.8.46422 > 192.168.0.24.11106: UDP, length 1472
18:30:08.557437 IP 192.168.0.8.46422 > 192.168.0.24.11106: UDP, length 1472
18:30:08.557458 IP 192.168.0.8.46422 > 192.168.0.24.11106: UDP, length 1472
18:30:08.559889 IP 192.168.0.8.46422 > 192.168.0.24.11106: UDP, length 1472
18:30:08.559910 IP 192.168.0.8.46422 > 192.168.0.24.11106: UDP, length 1472
18:30:08.562348 IP 192.168.0.8.46422 > 192.168.0.24.11106: UDP, length 1472
18:30:08.562370 IP 192.168.0.8.46422 > 192.168.0.24.11106: UDP, length 1472
18:30:08.564801 IP 192.168.0.8.46422 > 192.168.0.24.11106: UDP, length 1472
18:30:08.564823 IP 192.168.0.8.46422 > 192.168.0.24.11106: UDP, length 1472
18:30:08.567263 IP 192.168.0.8.46422 > 192.168.0.24.11106: UDP, length 1472
18:30:08.567288 IP 192.168.0.8.46422 > 192.168.0.24.11106: UDP, length 1472
18:30:08.569732 IP 192.168.0.8.46422 > 192.168.0.24.11106: UDP, length 1472
18:30:08.569757 IP 192.168.0.8.46422 > 192.168.0.24.11106: UDP, length 1472
18:30:08.572190 IP 192.168.0.8.46422 > 192.168.0.24.11106: UDP, length 1472
18:30:08.572212 IP 192.168.0.8.46422 > 192.168.0.24.11106: UDP, length 1472
18:30:08.574660 IP 192.168.0.8.46422 > 192.168.0.24.11106: UDP, length 1472
18:30:08.574684 IP 192.168.0.8.46422 > 192.168.0.24.11106: UDP, length 1472
18:30:08.577137 IP 192.168.0.8.46422 > 192.168.0.24.11106: UDP, length 1472
18:30:08.577162 IP 192.168.0.8.46422 > 192.168.0.24.11106: UDP, length 1472
18:30:08.579593 IP 192.168.0.8.46422 > 192.168.0.24.11106: UDP, length 1472
18:30:08.579615 IP 192.168.0.8.46422 > 192.168.0.24.11106: UDP, length 1472
18:30:08.582052 IP 192.168.0.8.46422 > 192.168.0.24.11106: UDP, length 1472
18:30:08.582075 IP 192.168.0.8.46422 > 192.168.0.24.11106: UDP, length 1472
18:30:08.584506 IP 192.168.0.8.46422 > 192.168.0.24.11106: UDP, length 1472
18:30:08.584528 IP 192.168.0.8.46422 > 192.168.0.24.11106: UDP, length 1472
18:30:08.586963 IP 192.168.0.8.46422 > 192.168.0.24.11106: UDP, length 1472
18:30:08.586985 IP 192.168.0.8.46422 > 192.168.0.24.11106: UDP, length 1472
18:30:08.589422 IP 192.168.0.8.46422 > 192.168.0.24.11106: UDP, length 1472
18:30:08.589444 IP 192.168.0.8.46422 > 192.168.0.24.11106: UDP, length 1472
18:30:08.591876 IP 192.168.0.8.46422 > 192.168.0.24.11106: UDP, length 1472
18:30:08.591899 IP 192.168.0.8.46422 > 192.168.0.24.11106: UDP, length 1472
